{
  "contract": "earlysignal-data-v1",
  "case_id": "PE16003",
  "labeler": "keyword",
  "odate": "2016-02-29",
  "target_categories": [
    "brakes"
  ],
  "groups": {
    "FORD|F-150": {
      "months": [
        "2012-03-01",
        "2012-04-01",
        "2012-05-01",
        "2012-06-01",
        "2012-07-01",
        "2012-08-01",
        "2012-09-01",
        "2012-10-01",
        "2012-11-01",
        "2012-12-01",
        "2013-01-01",
        "2013-02-01",
        "2013-03-01",
        "2013-04-01",
        "2013-05-01",
        "2013-06-01",
        "2013-07-01",
        "2013-08-01",
        "2013-09-01",
        "2013-10-01",
        "2013-11-01",
        "2013-12-01",
        "2014-01-01",
        "2014-02-01",
        "2014-03-01",
        "2014-04-01",
        "2014-05-01",
        "2014-06-01",
        "2014-07-01",
        "2014-08-01",
        "2014-09-01",
        "2014-10-01",
        "2014-11-01",
        "2014-12-01",
        "2015-01-01",
        "2015-02-01",
        "2015-03-01",
        "2015-04-01",
        "2015-05-01",
        "2015-06-01",
        "2015-07-01",
        "2015-08-01",
        "2015-09-01",
        "2015-10-01",
        "2015-11-01",
        "2015-12-01",
        "2016-01-01",
        "2016-02-01",
        "2016-03-01",
        "2016-04-01",
        "2016-05-01",
        "2016-06-01",
        "2016-07-01"
      ],
      "total": [
        66,
        56,
        56,
        51,
        64,
        50,
        50,
        46,
        35,
        42,
        45,
        53,
        51,
        45,
        174,
        127,
        115,
        102,
        92,
        75,
        54,
        62,
        77,
        77,
        93,
        74,
        79,
        76,
        81,
        94,
        97,
        74,
        76,
        90,
        107,
        81,
        97,
        70,
        58,
        88,
        93,
        100,
        80,
        102,
        104,
        82,
        105,
        86,
        154,
        110,
        111,
        128,
        143
      ],
      "categories": {
        "fire_thermal": {
          "n": [
            10,
            6,
            7,
            7,
            5,
            2,
            7,
            3,
            2,
            3,
            2,
            7,
            6,
            8,
            8,
            9,
            9,
            6,
            9,
            2,
            3,
            3,
            7,
            6,
            5,
            7,
            8,
            6,
            9,
            8,
            6,
            8,
            11,
            13,
            9,
            5,
            9,
            7,
            3,
            3,
            6,
            8,
            6,
            9,
            6,
            6,
            3,
            9,
            11,
            11,
            8,
            6,
            6
          ],
          "baseline": [
            null,
            null,
            null,
            null,
            null,
            6.166666666666667,
            5.571428571428571,
            5.75,
            5.444444444444445,
            5.1,
            4.909090909090909,
            4.666666666666667,
            5.083333333333333,
            4.75,
            4.916666666666667,
            5.0,
            5.166666666666667,
            5.5,
            5.833333333333333,
            6.0,
            5.916666666666667,
            6.0,
            6.0,
            6.416666666666667,
            6.333333333333333,
            6.25,
            6.166666666666667,
            6.166666666666667,
            5.916666666666667,
            5.916666666666667,
            6.083333333333333,
            5.833333333333333,
            6.333333333333333,
            7.0,
            7.833333333333333,
            8.0,
            7.916666666666667,
            8.25,
            8.25,
            7.833333333333333,
            7.583333333333333,
            7.333333333333333,
            7.333333333333333,
            7.333333333333333,
            7.416666666666667,
            7.0,
            6.416666666666667,
            5.916666666666667,
            6.25,
            6.416666666666667,
            6.75,
            7.166666666666667,
            7.416666666666667
          ],
          "alert": [
            false,
            false,
            false,
            false,
            false,
            false,
            false,
            false,
            false,
            false,
            false,
            false,
            false,
            false,
            false,
            false,
            false,
            false,
            false,
            false,
            false,
            false,
            false,
            false,
            false,
            false,
            false,
            false,
            false,
            false,
            false,
            false,
            false,
            false,
            false,
            false,
            false,
            false,
            false,
            false,
            false,
            false,
            false,
            false,
            false,
            false,
            false,
            false,
            false,
            false,
            false,
            false,
            false
          ]
        },
        "electrical_failure": {
          "n": [
            3,
            3,
            4,
            2,
            0,
            0,
            2,
            1,
            1,
            1,
            1,
            3,
            4,
            2,
            1,
            4,
            2,
            4,
            4,
            2,
            2,
            4,
            4,
            4,
            5,
            10,
            2,
            4,
            2,
            2,
            3,
            2,
            2,
            6,
            4,
            3,
            5,
            3,
            5,
            7,
            5,
            3,
            1,
            5,
            8,
            3,
            3,
            2,
            4,
            2,
            1,
            7,
            4
          ],
          "baseline": [
            null,
            null,
            null,
            null,
            null,
            2.3333333333333335,
            2.0,
            2.0,
            1.8888888888888888,
            1.8,
            1.7272727272727273,
            1.6666666666666667,
            1.75,
            1.8333333333333333,
            1.75,
            1.5,
            1.6666666666666667,
            1.8333333333333333,
            2.1666666666666665,
            2.3333333333333335,
            2.4166666666666665,
            2.5,
            2.75,
            3.0,
            3.0833333333333335,
            3.1666666666666665,
            3.8333333333333335,
            3.9166666666666665,
            3.9166666666666665,
            3.9166666666666665,
            3.75,
            3.6666666666666665,
            3.6666666666666665,
            3.6666666666666665,
            3.8333333333333335,
            3.8333333333333335,
            3.75,
            3.75,
            3.1666666666666665,
            3.4166666666666665,
            3.6666666666666665,
            3.9166666666666665,
            4.0,
            3.8333333333333335,
            4.083333333333333,
            4.583333333333333,
            4.333333333333333,
            4.25,
            4.166666666666667,
            4.083333333333333,
            4.0,
            3.6666666666666665,
            3.6666666666666665
          ],
          "alert": [
            false,
            false,
            false,
            false,
            false,
            false,
            false,
            false,
            false,
            false,
            false,
            false,
            false,
            false,
            false,
            false,
            false,
            false,
            false,
            false,
            false,
            false,
            false,
            false,
            false,
            false,
            false,
            false,
            false,
            false,
            false,
            false,
            false,
            false,
            false,
            false,
            false,
            false,
            false,
            false,
            false,
            false,
            false,
            false,
            false,
            false,
            false,
            false,
            false,
            false,
            false,
            false,
            false
          ]
        },
        "loss_of_power": {
          "n": [
            4,
            0,
            2,
            1,
            3,
            1,
            3,
            5,
            4,
            4,
            5,
            10,
            6,
            2,
            43,
            29,
            32,
            22,
            17,
            18,
            10,
            18,
            9,
            17,
            16,
            13,
            6,
            5,
            12,
            13,
            8,
            4,
            6,
            10,
            8,
            5,
            12,
            1,
            4,
            6,
            9,
            6,
            6,
            9,
            5,
            8,
            8,
            8,
            3,
            5,
            7,
            12,
            11
          ],
          "baseline": [
            null,
            null,
            null,
            null,
            null,
            1.6666666666666667,
            1.5714285714285714,
            1.75,
            2.111111111111111,
            2.3,
            2.4545454545454546,
            2.6666666666666665,
            3.5,
            3.6666666666666665,
            3.8333333333333335,